{
  "$schema": "http://json-schema.org/draft-07/schema#",
  "type": "object",
  "required": ["id", "title", "description", "level", "lessons"],
  "properties": {
    "$schema": { "type": "string" },
    "id": { "type": "string", "minLength": 1 },
    "title": { "type": "string", "minLength": 1 },
    "description": { "type": "string" },
    "level": { "enum": ["beginner", "intermediate", "advanced"] },
    "icon": { "type": "string", "description": "Строка с SVG" },
    "lessons": {
      "type": "array",
      "minItems": 1,
      "items": { "type": "string", "pattern": "^src/data/lessons/.*/lesson\\.json$" }
    }
  },
  "additionalProperties": false
}